{
  "$schema": "https://json-schema.org/draft/2020-12/schema",
  "$id": "https://raw.githubusercontent.com/akira-toriyama/furrow/main/docs/schema/furrow.task.v2.json",
  "title": "furrow task shard v2",
  "description": "Schema for one .furrow/tasks/<id>.json shard (a single task's metadata). The board-wide schema_version lives in .furrow/meta.json, never in a shard. v2 adds the required repos set (owner/repo identifiers; [] = draft, attached to no repo). Board layout v6 removed parent and type and added epic (the box a task belongs to); v8 added the optional due stamp (the instant a task is promised for); v10 added the optional repeat rule and its series anchor (a task that regenerates itself when closed); v11 added the optional anchor (the epic whose calendar day this task's due follows). Pin to a tagged URL or vendor this file.",
  "type": "object",
  "additionalProperties": true,
  "$comment": "true, deliberately: furrow PRESERVES top-level keys it does not know (a field written by a newer furrow that did not bump the layout version) and re-emits them on write, so a shard furrow itself produces may legitimately carry extras. Declaring them invalid here would make this artifact call furrow's own output non-conforming. Typo detection therefore lives in furrow lint, which warns unknown-shard-key (naming the task) — nothing else can, since nothing ever deletes an extra. NOTE $defs/checklistItem below keeps additionalProperties:false, because passthrough is TOP-LEVEL ONLY — an unknown key inside a checklist item really is still dropped, and this schema must not promise what the marshaller does not do.",
  "required": ["id", "title", "status", "priority", "labels", "repos", "deps", "refs", "checklist", "created", "updated", "closed", "reviewed", "body"],
  "properties": {
    "id": { "type": "string", "description": "frozen id; == the shard filename stem and bodies/<id>.md stem" },
    "title": { "type": "string" },
    "status": { "type": "string", "description": "a lane from config.toml [lanes].order" },
    "priority": { "type": "integer", "description": "sparse 10-step ordering key" },
    "value": { "type": "integer", "minimum": 1, "maximum": 5, "description": "optional coarse 1..5 value (importance) estimate; absent = unset" },
    "effort": { "type": "integer", "minimum": 1, "maximum": 5, "description": "optional coarse 1..5 effort (cost) estimate; absent = unset" },
    "labels": { "type": "array", "items": { "type": "string" }, "description": "free-form tags (labels are NOT repos; see repos)" },
    "repos": { "type": "array", "items": { "type": "string", "pattern": "^[A-Za-z0-9](?:[A-Za-z0-9-]*[A-Za-z0-9])?/[A-Za-z0-9._-]+$" }, "description": "repositories this task relates to, owner/repo form, sorted+deduped; [] = draft (no repo yet)" },
    "deps": { "type": "array", "items": { "type": "string" } },
    "refs": { "type": "array", "items": { "type": "string" } },
    "checklist": { "type": "array", "items": { "$ref": "#/$defs/checklistItem" } },
    "created": { "type": "string", "format": "date-time" },
    "updated": { "type": "string", "format": "date-time" },
    "closed": { "type": ["string", "null"], "format": "date-time" },
    "reviewed": { "type": ["string", "null"], "format": "date-time", "description": "when a human last reviewed this task (furrow review <id>); null = never. Tracked separately from updated." },
    "body": { "type": "string", "description": "relative path, e.g. bodies/t-0042.md" },
    "epic": { "type": "string", "description": "the epic (box) this task belongs to, 0..1 — an epics/<id>.json id. REQUIRED for an open task, enforced by furrow lint (epic-required) rather than at add time, so capture stays frictionless; absent is therefore legal on disk but flagged. furrow next scopes to the ACTIVE epic, which is why this is a schema field and not a label." },
    "repeat": { "type": "string", "description": "the recurrence rule this task runs on: ONE RFC 5545 RRULE line, with no DTSTART line (repeat_anchor carries the series start); absent = not repeating. Closing a repeating task generates its successor and MOVES this field (and repeat_anchor) to it, so the rule is held by exactly one task at a time — re-closing therefore cannot mint a second successor." },
    "repeat_anchor": { "type": "string", "format": "date-time", "description": "the series start the rule is expanded from: the FIRST occurrence's due. Immutable for the life of the series and inherited unchanged by each successor, which is what lets COUNT terminate and keeps a snooze (set --due) from re-latticing later occurrences. Present iff repeat is." },
    "due": { "type": "string", "format": "date-time", "description": "the instant this task is promised for; absent = no date (which is why it is not in required). An INSTANT, not a day: a date-only input (--due 2026-08-04) is bound to the END of that day in the operator's zone, so the day itself never starts out overdue. furrow lint ERRORS due-overdue and warns due-today, and furrow brief leads with the arrived ones — board-wide, not scoped to the active epic." },
    "anchor": { "type": "string", "description": "the epic whose anchor day this task's due FOLLOWS (board layout v11): an epics/<id>.json id; absent = the due follows nothing (every dated task before v11). When that box's anchor moves (furrow epic set --anchor), the due moves by the same calendar-day delta; the derivation (D-N) is never stored — due stays the absolute instant, and the offset is due minus anchor. Invariants the write path enforces and furrow lint backstops (anchor-missing, anchor-unset, anchor-undated, anchor-on-repeat): the box exists and has an anchor, the task carries a due, and it does not repeat (a series follows its own repeat_anchor). A done task keeps the pointer as history and is never moved." }
  },
  "$defs": {
    "checklistItem": {
      "type": "object",
      "additionalProperties": false,
      "required": ["text", "done"],
      "properties": {
        "text": { "type": "string" },
        "done": { "type": "boolean" }
      }
    }
  }
}
