{
  "id": "t-90mry",
  "title": "furrow: add --stdin (AddMany) が --type を黙って捨てる/検証しない — 単数 add との guard 不一致",
  "status": "ready",
  "priority": 100,
  "value": 3,
  "effort": 1,
  "labels": [
    "bug"
  ],
  "repos": [],
  "deps": [],
  "refs": [],
  "checklist": [],
  "created": "2026-07-22T11:07:01Z",
  "updated": "2026-07-22T11:07:01Z",
  "closed": null,
  "reviewed": null,
  "body": "bodies/t-90mry.md"
}
