{
  "id": "t-jb20w",
  "title": "e1",
  "status": "inbox",
  "priority": 110,
  "labels": [],
  "repos": [],
  "deps": [],
  "refs": [],
  "checklist": [],
  "created": "2026-07-22T07:44:20Z",
  "updated": "2026-07-22T07:44:20Z",
  "closed": null,
  "reviewed": null,
  "body": "bodies/t-jb20w.md"
}
