{
  "id": "t-1m7j0",
  "title": "furrow: title の内部改行/制御文字が body markdown に構造を注入する (glyph #61 の Flatten 相当が無い)",
  "status": "backlog",
  "priority": 110,
  "value": 3,
  "effort": 2,
  "labels": [
    "bug",
    "dx"
  ],
  "repos": [],
  "deps": [],
  "refs": [],
  "checklist": [],
  "created": "2026-07-22T11:07:01Z",
  "updated": "2026-07-22T11:07:01Z",
  "closed": null,
  "reviewed": null,
  "body": "bodies/t-1m7j0.md"
}
