{
  "id": "t-4xwzn",
  "title": "b1",
  "status": "inbox",
  "priority": 130,
  "labels": [],
  "repos": [],
  "deps": [],
  "refs": [],
  "checklist": [],
  "created": "2026-07-22T07:44:20Z",
  "updated": "2026-07-22T07:44:20Z",
  "closed": null,
  "reviewed": null,
  "body": "bodies/t-4xwzn.md"
}
