{
  "id": "t-73rza",
  "title": "furrow: sync のエラー分類が git の英語 stderr 部分文字列に依存（locale 非固定）— 非英語 locale で transient race を誤分類",
  "status": "backlog",
  "priority": 130,
  "value": 3,
  "effort": 2,
  "labels": [
    "bug"
  ],
  "repos": [],
  "deps": [],
  "refs": [],
  "checklist": [],
  "created": "2026-07-22T11:07:01Z",
  "updated": "2026-07-22T11:07:01Z",
  "closed": null,
  "reviewed": null,
  "body": "bodies/t-73rza.md"
}
