{
  "id": "t-0001",
  "title": "畝を一本進める <b>&amp;</b> 完了",
  "status": "in-progress",
  "priority": 110,
  "value": 4,
  "effort": 2,
  "labels": [
    "canon",
    "zmk"
  ],
  "repos": [
    "akira-toriyama/chord",
    "akira-toriyama/furrow"
  ],
  "deps": [
    "t-0002"
  ],
  "refs": [
    "docs/x.md#L10",
    "https://example.com"
  ],
  "checklist": [
    {
      "text": "design",
      "done": true
    },
    {
      "text": "ship",
      "done": false
    }
  ],
  "created": "2026-06-02T01:02:03Z",
  "updated": "2026-06-21T01:02:03Z",
  "closed": null,
  "reviewed": "2026-06-20T01:02:03Z",
  "body": "bodies/t-0001.md",
  "due": "2026-07-01T14:59:59Z",
  "repeat": "FREQ=WEEKLY;BYDAY=MO",
  "repeat_anchor": "2026-07-01T14:59:59Z",
  "anchor": "e-k3m9p"
}
